{
  "exerciseSessionId": "exercise_session_17b70728c8a54338b28a45b40c83092c",
  "sessionId": "mob_session_7b7c6d325d234be7b6cba379ad12c659",
  "exerciseId": "exercise_198d94eb671f48609039b1d5e6f4fb70",
  "exerciseName": "Barbell squat",
  "order": 1,
  "status": "ACTIVE",
  "targetSets": 4,
  "targetReps": 8,
  "targetRir": 2,
  "restDurationSeconds": 120
}
